=== Test Run Started: 2025-12-10 03:17:00 ===
Selected files: 23
Delay: 0ms, Timeout: 3s


=== Running lsg35.py ===
[info] Extracted Held class to schueler.py for lsg35.py
[info] Copied held_35.py to klassen/held.py for lsg35.py
pygame 2.6.1 (SDL 2.28.4, Python 3.10.11)
Hello from the pygame community. https://www.pygame.org/contribute.html
[Framework] Verwende system-installiertes pygame 2.6.1
(c) 2025 Johannes Harz
Fachkonferenz Informatik
Cusanus Gymnasium St. Wendel
Level 35 erfolgreich geladen.
[VICTORY] Klassenvalidierung erfolgreich abgeschlossen.
[VICTORY] Alle Siegbedingungen erfüllt!
[TEST] Level erfolgreich beendet.
=> OK
[info] Restored schueler.py after lsg35.py
[info] Restored klassen/held.py after lsg35.py

=== Running lsg37.py ===
[info] Extracted Held class to schueler.py for lsg37.py
[info] Copied held_35.py to klassen/held.py for lsg37.py
=> TIMEOUT

=== Running lsg38.py ===
[info] Copied held_lsg_38.py to klassen/held.py for lsg38.py
pygame 2.6.1 (SDL 2.28.4, Python 3.10.11)
Hello from the pygame community. https://www.pygame.org/contribute.html
[Framework] Verwende system-installiertes pygame 2.6.1
(c) 2025 Johannes Harz
Fachkonferenz Informatik
Cusanus Gymnasium St. Wendel
Level 38 erfolgreich geladen.
[VICTORY] Klassenvalidierung erfolgreich abgeschlossen.
[VICTORY] Alle Siegbedingungen erfüllt!
[TEST] Level erfolgreich beendet.
=> OK
[info] Restored klassen/held.py after lsg38.py

=== Running lsg39.py ===
[info] Copied held_38.py to klassen/held.py for lsg39.py
pygame 2.6.1 (SDL 2.28.4, Python 3.10.11)
Hello from the pygame community. https://www.pygame.org/contribute.html
[Framework] Verwende system-installiertes pygame 2.6.1
(c) 2025 Johannes Harz
Fachkonferenz Informatik
Cusanus Gymnasium St. Wendel
Level 39 erfolgreich geladen.
[VICTORY] Alle Siegbedingungen erfüllt!
[TEST] Level erfolgreich beendet.
=> OK
[info] Restored klassen/held.py after lsg39.py

=== Running lsg40.py ===
[info] Copied held_variant_correct.py to klassen/held.py for lsg40.py
pygame 2.6.1 (SDL 2.28.4, Python 3.10.11)
Hello from the pygame community. https://www.pygame.org/contribute.html
[Framework] Verwende system-installiertes pygame 2.6.1
(c) 2025 Johannes Harz
Fachkonferenz Informatik
Cusanus Gymnasium St. Wendel
Level 40 erfolgreich geladen.
[VICTORY] Klassenvalidierung erfolgreich abgeschlossen.
[VICTORY] Alle Siegbedingungen erfüllt!
[TEST] Level erfolgreich beendet.
=> OK
[info] Restored klassen/held.py after lsg40.py

=== Running lsg41.py ===
[info] Copied held_lsg41.py to klassen/held.py for lsg41.py
pygame 2.6.1 (SDL 2.28.4, Python 3.10.11)
Hello from the pygame community. https://www.pygame.org/contribute.html
[Framework] Verwende system-installiertes pygame 2.6.1
(c) 2025 Johannes Harz
Fachkonferenz Informatik
Cusanus Gymnasium St. Wendel
Level 41 erfolgreich geladen.
[VICTORY] Klassenvalidierung erfolgreich abgeschlossen.
[VICTORY] Alle Siegbedingungen erfüllt!
[TEST] Level erfolgreich beendet.
=> OK
[info] Restored klassen/held.py after lsg41.py

=== Running lsg42.py ===
[info] Copied held_lsg42.py to klassen/held.py for lsg42.py
pygame 2.6.1 (SDL 2.28.4, Python 3.10.11)
Hello from the pygame community. https://www.pygame.org/contribute.html
[Framework] Verwende system-installiertes pygame 2.6.1
(c) 2025 Johannes Harz
Fachkonferenz Informatik
Cusanus Gymnasium St. Wendel
Level 42 erfolgreich geladen.
[VICTORY] Klassenvalidierung erfolgreich abgeschlossen.
[VICTORY] Alle Siegbedingungen erfüllt!
[TEST] Level erfolgreich beendet.
=> OK
[info] Restored klassen/held.py after lsg42.py

=== Running lsg42_held.py ===
[info] Copied held_lsg42.py to klassen/held.py for lsg42_held.py
pygame 2.6.1 (SDL 2.28.4, Python 3.10.11)
Hello from the pygame community. https://www.pygame.org/contribute.html
[Framework] Verwende system-installiertes pygame 2.6.1
(c) 2025 Johannes Harz
Fachkonferenz Informatik
Cusanus Gymnasium St. Wendel
Level 42 erfolgreich geladen.
[VICTORY] Klassenvalidierung erfolgreich abgeschlossen.
[VICTORY] Alle Siegbedingungen erfüllt!
[TEST] Level erfolgreich beendet.
=> OK
[info] Restored klassen/held.py after lsg42_held.py

=== Running lsg43.py ===
[info] Copied held_lsg43.py to klassen/held.py for lsg43.py
pygame 2.6.1 (SDL 2.28.4, Python 3.10.11)
Hello from the pygame community. https://www.pygame.org/contribute.html
[Framework] Verwende system-installiertes pygame 2.6.1
(c) 2025 Johannes Harz
Fachkonferenz Informatik
Cusanus Gymnasium St. Wendel
Level 43 erfolgreich geladen.
[VICTORY] Klassenvalidierung erfolgreich abgeschlossen.
[VICTORY] Alle Siegbedingungen erfüllt!
[TEST] Level erfolgreich beendet.
=> OK
[info] Restored klassen/held.py after lsg43.py

=== Running lsg43_held.py ===
[info] Copied held_lsg43.py to klassen/held.py for lsg43_held.py
pygame 2.6.1 (SDL 2.28.4, Python 3.10.11)
Hello from the pygame community. https://www.pygame.org/contribute.html
[Framework] Verwende system-installiertes pygame 2.6.1
(c) 2025 Johannes Harz
Fachkonferenz Informatik
Cusanus Gymnasium St. Wendel
Level 43 erfolgreich geladen.
[VICTORY] Klassenvalidierung erfolgreich abgeschlossen.
[VICTORY] Alle Siegbedingungen erfüllt!
[TEST] Level erfolgreich beendet.
=> OK
[info] Restored klassen/held.py after lsg43_held.py

=== Running lsg44.py ===
[info] Copied hindernis_correct.py to klassen/hindernis.py for lsg44.py
pygame 2.6.1 (SDL 2.28.4, Python 3.10.11)
Hello from the pygame community. https://www.pygame.org/contribute.html
[Framework] Verwende system-installiertes pygame 2.6.1
(c) 2025 Johannes Harz
Fachkonferenz Informatik
Cusanus Gymnasium St. Wendel
Level 44 erfolgreich geladen.
[VICTORY] Klassenvalidierung erfolgreich abgeschlossen.
[VICTORY] Alle Siegbedingungen erfüllt!
[TEST] Level erfolgreich beendet.
=> OK
[info] Restored klassen/hindernis.py after lsg44.py

=== Running lsg45.py ===
[info] Copied zettel_correct.py to klassen/zettel.py for lsg45.py
pygame 2.6.1 (SDL 2.28.4, Python 3.10.11)
Hello from the pygame community. https://www.pygame.org/contribute.html
[Framework] Verwende system-installiertes pygame 2.6.1
(c) 2025 Johannes Harz
Fachkonferenz Informatik
Cusanus Gymnasium St. Wendel
Level 45 erfolgreich geladen.
[VICTORY] Klassenvalidierung erfolgreich abgeschlossen.
[VICTORY] Alle Siegbedingungen erfüllt!
[TEST] Level erfolgreich beendet.
=> OK
[info] Restored klassen/zettel.py after lsg45.py

=== Running lsg50.py ===
[info] Copied spielobjekt_50.py to klassen/spielobjekt.py for lsg50.py
[info] Copied hindernis_50.py to klassen/hindernis.py for lsg50.py
[info] Copied zettel_50.py to klassen/zettel.py for lsg50.py
pygame 2.6.1 (SDL 2.28.4, Python 3.10.11)
Hello from the pygame community. https://www.pygame.org/contribute.html
[Framework] Verwende system-installiertes pygame 2.6.1
(c) 2025 Johannes Harz
Fachkonferenz Informatik
Cusanus Gymnasium St. Wendel
Level 50 erfolgreich geladen.
[VICTORY] Klassenvalidierung erfolgreich abgeschlossen.
[VICTORY] Alle Siegbedingungen erfüllt!
[TEST] Level erfolgreich beendet.
=> OK
[info] Restored klassen/hindernis.py after lsg50.py
[info] Restored klassen/zettel.py after lsg50.py
[info] Restored klassen/spielobjekt.py after lsg50.py
[info] Restored klassen/spielobjekt.py after lsg50.py

=== Running lsg56.py ===
[info] Copied gegenstand_56.py to klassen/gegenstand.py for lsg56.py
[info] Copied inventar_56.py to klassen/inventar.py for lsg56.py
pygame 2.6.1 (SDL 2.28.4, Python 3.10.11)
Hello from the pygame community. https://www.pygame.org/contribute.html
[Framework] Verwende system-installiertes pygame 2.6.1
(c) 2025 Johannes Harz
Fachkonferenz Informatik
Cusanus Gymnasium St. Wendel
Level 56 erfolgreich geladen.
[VICTORY] Klassenvalidierung erfolgreich abgeschlossen.
[VICTORY] Alle Siegbedingungen erfüllt!
[TEST] Level erfolgreich beendet.
=> OK
[info] Restored klassen/inventar.py after lsg56.py
[info] Restored klassen/gegenstand.py after lsg56.py

=== Running lsg56_gegenstand.py ===
[info] Copied gegenstand_56.py to klassen/gegenstand.py for lsg56_gegenstand.py
[info] Copied inventar_56.py to klassen/inventar.py for lsg56_gegenstand.py
pygame 2.6.1 (SDL 2.28.4, Python 3.10.11)
Hello from the pygame community. https://www.pygame.org/contribute.html
[Framework] Verwende system-installiertes pygame 2.6.1
(c) 2025 Johannes Harz
Fachkonferenz Informatik
Cusanus Gymnasium St. Wendel
Level 56 erfolgreich geladen.
[VICTORY] Klassenvalidierung erfolgreich abgeschlossen.
[VICTORY] Alle Siegbedingungen erfüllt!
[TEST] Level erfolgreich beendet.
=> OK
[info] Restored klassen/inventar.py after lsg56_gegenstand.py
[info] Restored klassen/gegenstand.py after lsg56_gegenstand.py

=== Running lsg56_inventar.py ===
[info] Copied gegenstand_56.py to klassen/gegenstand.py for lsg56_inventar.py
[info] Copied inventar_56.py to klassen/inventar.py for lsg56_inventar.py
pygame 2.6.1 (SDL 2.28.4, Python 3.10.11)
Hello from the pygame community. https://www.pygame.org/contribute.html
  File "d:\git\oop_framework\lsg\lsg56_inventar.py", line 11
    def anzahl_items(self):
IndentationError: unexpected indent
=> FAIL (code 1)
[info] Restored klassen/inventar.py after lsg56_inventar.py
[info] Restored klassen/gegenstand.py after lsg56_inventar.py

=== Running lsg57.py ===
[info] Copied held_57.py to klassen/held.py for lsg57.py
[info] Copied knappe_57.py to klassen/knappe.py for lsg57.py
[info] Copied inventar_56.py to klassen/inventar.py for lsg57.py
[info] Copied gegenstand_56.py to klassen/gegenstand.py for lsg57.py
pygame 2.6.1 (SDL 2.28.4, Python 3.10.11)
Hello from the pygame community. https://www.pygame.org/contribute.html
[Framework] Verwende system-installiertes pygame 2.6.1
(c) 2025 Johannes Harz
Fachkonferenz Informatik
Cusanus Gymnasium St. Wendel
Level 57 erfolgreich geladen.
[VICTORY] Klassenvalidierung erfolgreich abgeschlossen.
[VICTORY] Alle Siegbedingungen erfüllt!
[TEST] Level erfolgreich beendet.
=> OK
[info] Restored klassen/inventar.py after lsg57.py
[info] Restored klassen/gegenstand.py after lsg57.py
[info] Restored klassen/held.py after lsg57.py
[info] Restored klassen/knappe.py after lsg57.py

=== Running lsg57_held.py ===
[info] Copied held_57.py to klassen/held.py for lsg57_held.py
[info] Copied knappe_57.py to klassen/knappe.py for lsg57_held.py
[info] Copied inventar_56.py to klassen/inventar.py for lsg57_held.py
[info] Copied gegenstand_56.py to klassen/gegenstand.py for lsg57_held.py
pygame 2.6.1 (SDL 2.28.4, Python 3.10.11)
Hello from the pygame community. https://www.pygame.org/contribute.html
[Framework] Verwende system-installiertes pygame 2.6.1
(c) 2025 Johannes Harz
Fachkonferenz Informatik
Cusanus Gymnasium St. Wendel
Level 57 erfolgreich geladen.
[VICTORY] Klassenvalidierung erfolgreich abgeschlossen.
[VICTORY] Alle Siegbedingungen erfüllt!
[TEST] Level erfolgreich beendet.
=> OK
[info] Restored klassen/inventar.py after lsg57_held.py
[info] Restored klassen/gegenstand.py after lsg57_held.py
[info] Restored klassen/held.py after lsg57_held.py
[info] Restored klassen/knappe.py after lsg57_held.py

=== Running lsg57_knappe.py ===
[info] Copied held_57.py to klassen/held.py for lsg57_knappe.py
[info] Copied knappe_57.py to klassen/knappe.py for lsg57_knappe.py
[info] Copied inventar_56.py to klassen/inventar.py for lsg57_knappe.py
[info] Copied gegenstand_56.py to klassen/gegenstand.py for lsg57_knappe.py
pygame 2.6.1 (SDL 2.28.4, Python 3.10.11)
Hello from the pygame community. https://www.pygame.org/contribute.html
[Framework] Verwende system-installiertes pygame 2.6.1
(c) 2025 Johannes Harz
Fachkonferenz Informatik
Cusanus Gymnasium St. Wendel
Level 57 erfolgreich geladen.
[VICTORY] Klassenvalidierung erfolgreich abgeschlossen.
[VICTORY] Alle Siegbedingungen erfüllt!
[TEST] Level erfolgreich beendet.
=> OK
[info] Restored klassen/inventar.py after lsg57_knappe.py
[info] Restored klassen/gegenstand.py after lsg57_knappe.py
[info] Restored klassen/held.py after lsg57_knappe.py
[info] Restored klassen/knappe.py after lsg57_knappe.py

=== Running lsg_46_knappe.py ===
pygame 2.6.1 (SDL 2.28.4, Python 3.10.11)
Hello from the pygame community. https://www.pygame.org/contribute.html
=> OK

=== Running lsg_47_spielobjekt.py ===
pygame 2.6.1 (SDL 2.28.4, Python 3.10.11)
Hello from the pygame community. https://www.pygame.org/contribute.html
=> OK

=== Running lsg_48_hindernis.py ===
pygame 2.6.1 (SDL 2.28.4, Python 3.10.11)
Hello from the pygame community. https://www.pygame.org/contribute.html
=> OK

=== Running lsg_48_spielobjekt.py ===
pygame 2.6.1 (SDL 2.28.4, Python 3.10.11)
Hello from the pygame community. https://www.pygame.org/contribute.html
=> OK

--- summary ---
lsg35.py: OK
lsg37.py: FAIL (124) [DEVIATION: Expected PASS, got FAIL]
lsg38.py: OK
lsg39.py: OK
lsg40.py: OK
lsg41.py: OK
lsg42.py: OK
lsg42_held.py: OK
lsg43.py: OK
lsg43_held.py: OK
lsg44.py: OK
lsg45.py: OK
lsg50.py: OK
lsg56.py: OK
lsg56_gegenstand.py: OK
lsg56_inventar.py: FAIL (1) [DEVIATION: Expected PASS, got FAIL]
lsg57.py: OK
lsg57_held.py: OK
lsg57_knappe.py: OK
lsg_46_knappe.py: OK
lsg_47_spielobjekt.py: OK
lsg_48_hindernis.py: OK
lsg_48_spielobjekt.py: OK

--- DEVIATIONS (2/23) ---
lsg37.py: Expected PASS, got FAIL
lsg56_inventar.py: Expected PASS, got FAIL

=== Test Run Finished: 2025-12-10 03:17:23 ===
