=== Test Run Started: 2025-12-08 21:50:18 ===
Selected files: 33
Delay: 0ms, Timeout: 3s


=== Running lsg104.py ===
pygame 2.3.0 (SDL 2.24.2, Python 3.10.9)
Hello from the pygame community. https://www.pygame.org/contribute.html
(c) 2025 Johannes Harz
Fachkonferenz Informatik
Cusanus Gymnasium St. Wendel
Level 104 erfolgreich geladen.
<Surface(128x128x32 SW)> <Surface(128x128x32 SW)> left
[VICTORY] Alle Siegbedingungen erfüllt!
[TEST] Level erfolgreich beendet.
=> OK

=== Running lsg341.py ===
pygame 2.3.0 (SDL 2.24.2, Python 3.10.9)
Hello from the pygame community. https://www.pygame.org/contribute.html
(c) 2025 Johannes Harz
Fachkonferenz Informatik
Cusanus Gymnasium St. Wendel
Level 341 erfolgreich geladen.
[VICTORY] Alle Siegbedingungen erfüllt!
[TEST] Level erfolgreich beendet.
=> OK

=== Running lsg341_expected_fail.py ===
=> TIMEOUT

=== Running lsg35.py ===
[info] Extracted Held class to schueler.py for lsg35.py
pygame 2.3.0 (SDL 2.24.2, Python 3.10.9)
Hello from the pygame community. https://www.pygame.org/contribute.html
(c) 2025 Johannes Harz
Fachkonferenz Informatik
Cusanus Gymnasium St. Wendel
Klasse Hindernis fehlt
Klasse Knappe fehlt
Level 35 erfolgreich geladen.
[VICTORY] Klassenvalidierung erfolgreich abgeschlossen.
[VICTORY] Alle Siegbedingungen erfüllt!
[TEST] Level erfolgreich beendet.
=> OK
[info] Restored schueler.py after lsg35.py

=== Running lsg37.py ===
[info] Extracted Held class to schueler.py for lsg37.py
pygame 2.3.0 (SDL 2.24.2, Python 3.10.9)
Hello from the pygame community. https://www.pygame.org/contribute.html
(c) 2025 Johannes Harz
Fachkonferenz Informatik
Cusanus Gymnasium St. Wendel
Klasse Hindernis fehlt
Klasse Knappe fehlt
Level 37 erfolgreich geladen.
[VICTORY] Klassenvalidierung erfolgreich abgeschlossen.
[VICTORY] Alle Siegbedingungen erfüllt!
[TEST] Level erfolgreich beendet.
=> OK
[info] Restored schueler.py after lsg37.py

=== Running lsg38.py ===
[warning] Could not replace klassen/held.py for lsg38.py: local variable 'held_38_content' referenced before assignment
pygame 2.3.0 (SDL 2.24.2, Python 3.10.9)
Hello from the pygame community. https://www.pygame.org/contribute.html
(c) 2025 Johannes Harz
Fachkonferenz Informatik
Cusanus Gymnasium St. Wendel
Klasse Hindernis fehlt
Klasse Knappe fehlt
[FEHLER] Helden Klasse fehlt
Level 38 erfolgreich geladen.
[VICTORY] Klasse 'Held' nicht gefunden.
Traceback (most recent call last):
  File "D:\git\oop_framework\lsg\lsg38.py", line 6, in <module>
    held.geh()
AttributeError: 'NoneType' object has no attribute 'geh'
=> FAIL (code 1)
[info] Restored klassen/held.py after lsg38.py

=== Running lsg39.py ===
[info] Copied held_38.py to klassen/held.py for lsg39.py
pygame 2.3.0 (SDL 2.24.2, Python 3.10.9)
Hello from the pygame community. https://www.pygame.org/contribute.html
(c) 2025 Johannes Harz
Fachkonferenz Informatik
Cusanus Gymnasium St. Wendel
Level 39 erfolgreich geladen.
[VICTORY] Alle Siegbedingungen erfüllt!
[TEST] Level erfolgreich beendet.
=> OK
[info] Restored klassen/held.py after lsg39.py

=== Running lsg39_expected_fail_missing_import.py ===
[info] Copied held_38.py to klassen/held.py for lsg39_expected_fail_missing_import.py
pygame 2.3.0 (SDL 2.24.2, Python 3.10.9)
Hello from the pygame community. https://www.pygame.org/contribute.html
(c) 2025 Johannes Harz
Fachkonferenz Informatik
Cusanus Gymnasium St. Wendel
Level 39 erfolgreich geladen.
Traceback (most recent call last):
  File "D:\git\oop_framework\lsg\lsg39_expected_fail_missing_import.py", line 7, in <module>
    held = Held(3, 2, "left", weiblich=True)
NameError: name 'Held' is not defined. Did you mean: 'held'?
=> FAIL (code 1)
[info] Restored klassen/held.py after lsg39_expected_fail_missing_import.py

=== Running lsg39_expected_fail_wrong_position.py ===
[info] Copied held_38.py to klassen/held.py for lsg39_expected_fail_wrong_position.py
=> TIMEOUT

=== Running lsg40.py ===
[info] Copied held_variant_correct.py to klassen/held.py for lsg40.py
pygame 2.3.0 (SDL 2.24.2, Python 3.10.9)
Hello from the pygame community. https://www.pygame.org/contribute.html
(c) 2025 Johannes Harz
Fachkonferenz Informatik
Cusanus Gymnasium St. Wendel
Klasse Hindernis fehlt
Klasse Knappe fehlt
Level 40 erfolgreich geladen.
[VICTORY] Klassenvalidierung erfolgreich abgeschlossen.
[VICTORY] Alle Siegbedingungen erfüllt!
[TEST] Level erfolgreich beendet.
=> OK
[info] Restored klassen/held.py after lsg40.py

=== Running lsg40_expected_fail_public_attributes.py ===
[info] Copied held_variant_public_attributes.py to klassen/held.py for lsg40_expected_fail_public_attributes.py
=> TIMEOUT

=== Running lsg41.py ===
[info] Copied held_lsg41.py to klassen/held.py for lsg41.py
pygame 2.3.0 (SDL 2.24.2, Python 3.10.9)
Hello from the pygame community. https://www.pygame.org/contribute.html
(c) 2025 Johannes Harz
Fachkonferenz Informatik
Cusanus Gymnasium St. Wendel
Klasse Hindernis fehlt
Klasse Knappe fehlt
Level 41 erfolgreich geladen.
[VICTORY] Klassenvalidierung erfolgreich abgeschlossen.
[VICTORY] Alle Siegbedingungen erfüllt!
[TEST] Level erfolgreich beendet.
=> OK
[info] Restored klassen/held.py after lsg41.py

=== Running lsg41_expected_fail_missing_getters.py ===
[info] Copied held_variant_missing_getters.py to klassen/held.py for lsg41_expected_fail_missing_getters.py
=> TIMEOUT

=== Running lsg41_expected_fail_public_attributes.py ===
[info] Copied held_variant_public_attributes.py to klassen/held.py for lsg41_expected_fail_public_attributes.py
=> TIMEOUT

=== Running lsg42.py ===
[info] Copied held_lsg42.py to klassen/held.py for lsg42.py
pygame 2.3.0 (SDL 2.24.2, Python 3.10.9)
Hello from the pygame community. https://www.pygame.org/contribute.html
(c) 2025 Johannes Harz
Fachkonferenz Informatik
Cusanus Gymnasium St. Wendel
Klasse Hindernis fehlt
Klasse Knappe fehlt
Level 42 erfolgreich geladen.
[VICTORY] Klassenvalidierung erfolgreich abgeschlossen.
[VICTORY] Alle Siegbedingungen erfüllt!
[TEST] Level erfolgreich beendet.
=> OK
[info] Restored klassen/held.py after lsg42.py

=== Running lsg42_expected_fail_missing_getters.py ===
[info] Copied held_variant_missing_getters.py to klassen/held.py for lsg42_expected_fail_missing_getters.py
=> TIMEOUT

=== Running lsg42_expected_fail_public_attributes.py ===
[info] Copied held_variant_public_attributes.py to klassen/held.py for lsg42_expected_fail_public_attributes.py
=> TIMEOUT

=== Running lsg42_held.py ===
[info] Copied held_lsg42.py to klassen/held.py for lsg42_held.py
pygame 2.3.0 (SDL 2.24.2, Python 3.10.9)
Hello from the pygame community. https://www.pygame.org/contribute.html
(c) 2025 Johannes Harz
Fachkonferenz Informatik
Cusanus Gymnasium St. Wendel
Klasse Hindernis fehlt
Klasse Knappe fehlt
Level 42 erfolgreich geladen.
[VICTORY] Klassenvalidierung erfolgreich abgeschlossen.
[VICTORY] Alle Siegbedingungen erfüllt!
[TEST] Level erfolgreich beendet.
=> OK
[info] Restored klassen/held.py after lsg42_held.py

=== Running lsg43.py ===
[info] Copied held_lsg43.py to klassen/held.py for lsg43.py
pygame 2.3.0 (SDL 2.24.2, Python 3.10.9)
Hello from the pygame community. https://www.pygame.org/contribute.html
(c) 2025 Johannes Harz
Fachkonferenz Informatik
Cusanus Gymnasium St. Wendel
Klasse Hindernis fehlt
Klasse Knappe fehlt
Level 43 erfolgreich geladen.
[VICTORY] Klassenvalidierung erfolgreich abgeschlossen.
[VICTORY] Alle Siegbedingungen erfüllt!
[TEST] Level erfolgreich beendet.
=> OK
[info] Restored klassen/held.py after lsg43.py

=== Running lsg43_held.py ===
[info] Copied held_lsg43.py to klassen/held.py for lsg43_held.py
pygame 2.3.0 (SDL 2.24.2, Python 3.10.9)
Hello from the pygame community. https://www.pygame.org/contribute.html
(c) 2025 Johannes Harz
Fachkonferenz Informatik
Cusanus Gymnasium St. Wendel
Klasse Hindernis fehlt
Klasse Knappe fehlt
Level 43 erfolgreich geladen.
[VICTORY] Klassenvalidierung erfolgreich abgeschlossen.
[VICTORY] Alle Siegbedingungen erfüllt!
[TEST] Level erfolgreich beendet.
=> OK
[info] Restored klassen/held.py after lsg43_held.py

=== Running lsg44.py ===
[info] Copied hindernis_correct.py to klassen/hindernis.py for lsg44.py
pygame 2.3.0 (SDL 2.24.2, Python 3.10.9)
Hello from the pygame community. https://www.pygame.org/contribute.html
(c) 2025 Johannes Harz
Fachkonferenz Informatik
Cusanus Gymnasium St. Wendel
Klasse Knappe fehlt
Level 44 erfolgreich geladen.
[VICTORY] Klassenvalidierung erfolgreich abgeschlossen.
[VICTORY] Alle Siegbedingungen erfüllt!
[TEST] Level erfolgreich beendet.
=> OK
[info] Restored klassen/hindernis.py after lsg44.py

=== Running lsg45.py ===
[info] Copied zettel_correct.py to klassen/zettel.py for lsg45.py
pygame 2.3.0 (SDL 2.24.2, Python 3.10.9)
Hello from the pygame community. https://www.pygame.org/contribute.html
(c) 2025 Johannes Harz
Fachkonferenz Informatik
Cusanus Gymnasium St. Wendel
Klasse Hindernis fehlt
Klasse Knappe fehlt
Level 45 erfolgreich geladen.
[VICTORY] Klassenvalidierung erfolgreich abgeschlossen.
[VICTORY] Alle Siegbedingungen erfüllt!
[TEST] Level erfolgreich beendet.
=> OK
[info] Restored klassen/zettel.py after lsg45.py

=== Running lsg50.py ===
[info] Copied spielobjekt_50.py to klassen/spielobjekt.py for lsg50.py
[info] Copied hindernis_50.py to klassen/hindernis.py for lsg50.py
[info] Copied zettel_50.py to klassen/zettel.py for lsg50.py
pygame 2.3.0 (SDL 2.24.2, Python 3.10.9)
Hello from the pygame community. https://www.pygame.org/contribute.html
(c) 2025 Johannes Harz
Fachkonferenz Informatik
Cusanus Gymnasium St. Wendel
Klasse Knappe fehlt
Level 50 erfolgreich geladen.
[VICTORY] Klassenvalidierung erfolgreich abgeschlossen.
[VICTORY] Alle Siegbedingungen erfüllt!
[TEST] Level erfolgreich beendet.
=> OK
[info] Restored klassen/hindernis.py after lsg50.py
[info] Restored klassen/zettel.py after lsg50.py
[info] Restored klassen/spielobjekt.py after lsg50.py

=== Running lsg50_expected_fail_hindernis48.py ===
[info] Copied spielobjekt_50.py to klassen/spielobjekt.py for lsg50_expected_fail_hindernis48.py
[info] Copied hindernis_48.py to klassen/hindernis.py for lsg50_expected_fail_hindernis48.py
[info] Copied zettel_50.py to klassen/zettel.py for lsg50_expected_fail_hindernis48.py
pygame 2.3.0 (SDL 2.24.2, Python 3.10.9)
Hello from the pygame community. https://www.pygame.org/contribute.html
(c) 2025 Johannes Harz
Fachkonferenz Informatik
Cusanus Gymnasium St. Wendel
Klasse Knappe fehlt
Level 50 erfolgreich geladen.
[VICTORY] Klassenvalidierung erfolgreich abgeschlossen.
[VICTORY] Alle Siegbedingungen erfüllt!
[TEST] Level erfolgreich beendet.
=> OK
[info] Restored klassen/hindernis.py after lsg50_expected_fail_hindernis48.py
[info] Restored klassen/zettel.py after lsg50_expected_fail_hindernis48.py
[info] Restored klassen/spielobjekt.py after lsg50_expected_fail_hindernis48.py

=== Running lsg50_expected_fail_no_inheritance.py ===
[info] Copied spielobjekt_50.py to klassen/spielobjekt.py for lsg50_expected_fail_no_inheritance.py
[info] Copied hindernis_50_no_inherit.py to klassen/hindernis.py for lsg50_expected_fail_no_inheritance.py
[info] Copied zettel_50_no_inherit.py to klassen/zettel.py for lsg50_expected_fail_no_inheritance.py
=> TIMEOUT

=== Running lsg50_expected_fail_spielobjekt_private.py ===
[info] Copied spielobjekt_50_private.py to klassen/spielobjekt.py for lsg50_expected_fail_spielobjekt_private.py
[info] Copied hindernis_50.py to klassen/hindernis.py for lsg50_expected_fail_spielobjekt_private.py
[info] Copied zettel_50.py to klassen/zettel.py for lsg50_expected_fail_spielobjekt_private.py
=> TIMEOUT

=== Running lsg50_expected_fail_zettel49.py ===
[info] Copied spielobjekt_50.py to klassen/spielobjekt.py for lsg50_expected_fail_zettel49.py
[info] Copied hindernis_50.py to klassen/hindernis.py for lsg50_expected_fail_zettel49.py
[info] Copied zettel_49.py to klassen/zettel.py for lsg50_expected_fail_zettel49.py
=> TIMEOUT

=== Running lsg_0_expected_fail.py ===
=> TIMEOUT

=== Running lsg_46_knappe.py ===
pygame 2.3.0 (SDL 2.24.2, Python 3.10.9)
Hello from the pygame community. https://www.pygame.org/contribute.html
=> OK

=== Running lsg_47_spielobjekt.py ===
pygame 2.3.0 (SDL 2.24.2, Python 3.10.9)
Hello from the pygame community. https://www.pygame.org/contribute.html
=> OK

=== Running lsg_48_hindernis.py ===
pygame 2.3.0 (SDL 2.24.2, Python 3.10.9)
Hello from the pygame community. https://www.pygame.org/contribute.html
=> OK

=== Running lsg_48_spielobjekt.py ===
pygame 2.3.0 (SDL 2.24.2, Python 3.10.9)
Hello from the pygame community. https://www.pygame.org/contribute.html
=> OK

=== Running lsg_4_expected_fail.py ===
=> TIMEOUT

--- summary ---
lsg104.py: OK
lsg341.py: OK
lsg341_expected_fail.py: FAIL (124)
lsg35.py: OK
lsg37.py: OK
lsg38.py: FAIL (1) [DEVIATION: Expected PASS, got FAIL]
lsg39.py: OK
lsg39_expected_fail_missing_import.py: FAIL (1)
lsg39_expected_fail_wrong_position.py: FAIL (124)
lsg40.py: OK
lsg40_expected_fail_public_attributes.py: FAIL (124)
lsg41.py: OK
lsg41_expected_fail_missing_getters.py: FAIL (124)
lsg41_expected_fail_public_attributes.py: FAIL (124)
lsg42.py: OK
lsg42_expected_fail_missing_getters.py: FAIL (124)
lsg42_expected_fail_public_attributes.py: FAIL (124)
lsg42_held.py: OK
lsg43.py: OK
lsg43_held.py: OK
lsg44.py: OK
lsg45.py: OK
lsg50.py: OK
lsg50_expected_fail_hindernis48.py: OK [DEVIATION: Expected FAIL, got PASS]
lsg50_expected_fail_no_inheritance.py: FAIL (124)
lsg50_expected_fail_spielobjekt_private.py: FAIL (124)
lsg50_expected_fail_zettel49.py: FAIL (124)
lsg_0_expected_fail.py: FAIL (124)
lsg_46_knappe.py: OK
lsg_47_spielobjekt.py: OK
lsg_48_hindernis.py: OK
lsg_48_spielobjekt.py: OK
lsg_4_expected_fail.py: FAIL (124)

--- DEVIATIONS (2/33) ---
lsg38.py: Expected PASS, got FAIL
lsg50_expected_fail_hindernis48.py: Expected FAIL, got PASS

=== Test Run Finished: 2025-12-08 21:51:16 ===
